<?xml version="1.0" encoding="UTF-8"?>
<schema xmlns="http://www.w3.org/2001/XMLSchema" targetNamespace="http://www.epam.com/candy"
	xmlns:tns="http://www.epam.com/candy" elementFormDefault="qualified">
	<element name="candys">
		<complexType>
			<sequence>
				<element name="candy" type="tns:candy" minOccurs="5"
					maxOccurs="unbounded" />
			</sequence>
		</complexType>
	</element>
	<complexType name="candy">
		<sequence>
			<element name="name" type="string" />
			<element name="energy" type="string" />
			<element name="production" type="string" />
			<element name="value" type="tns:Value" />
			<element name="ingredients" type="tns:Ingredient" />
		</sequence>
		<attribute name="Type" use="required">
			<simpleType>
				<restriction base="string">
					<enumeration value="caramel"></enumeration>
					<enumeration value="toffee"></enumeration>
					<enumeration value="chocolate"></enumeration>
					<enumeration value="chocolate with stuffed"></enumeration>
				</restriction>
			</simpleType>
		</attribute>

	</complexType>
	<complexType name="Value">
		<sequence>
			<element name="proteins" type="positiveInteger" />
			<element name="fats" type="positiveInteger" />
			<element name="carbahydrates" type="positiveInteger" />
		</sequence>
	</complexType>
	<complexType name="Ingredient">
		<sequence>
			<element name="fructose" type="positiveInteger" />
			<element name="sugar" type="positiveInteger" />
			<element name="vanilin" type="positiveInteger" />
			<element name="water" type="positiveInteger" />
		</sequence>
		<attribute name="typeOfchocolate" use="required">
			<simpleType>
				<restriction base="string">
					<enumeration value="blackChocolate"></enumeration>
					<enumeration value="whiteChocolate"></enumeration>
				</restriction>
			</simpleType>
		</attribute>
	</complexType>

</schema>